{
  "schema_version": 1,
  "id": "p-999-coverage-v1",
  "simulation_id": "simulation-correctness-fixture",
  "population_id": "support-actors-v2",
  "mode": "coverage",
  "product_personas": [
    {
      "persona_id": "P-999",
      "revision": 1,
      "path": "docs/product/personas/fixtures/P-999-framework-support-role.md",
      "sha256": "472a0e9880e8b5e7abc410539f61cc35f62746561239be2768c246e0e3958fe3"
    }
  ],
  "dimensions": [
    {
      "id": "communication-directness",
      "description": "Vary deterministic communication clarity without inferring real-user prevalence.",
      "source_persona_ids": ["P-999"],
      "confidence": "low",
      "uncertainty": "The fixture provides no evidence about real support users.",
      "permitted_variation": true
    }
  ],
  "invariants": [
    "Exercise only deterministic framework contract behavior.",
    "Never support product, population, calibration, or release claims."
  ],
  "mutation_axes": [
    {
      "id": "communication-clarity",
      "values": ["direct", "ambiguous"],
      "rationale": "Cover deterministic standard and risk slices."
    }
  ],
  "actors": [
    {
      "id": "standard-actor",
      "weight": 0.7,
      "actor_class": "representative",
      "persona_ids": ["P-999"],
      "goals": ["complete the deterministic support task"],
      "invariants": ["do not infer real-user behavior"],
      "knowledge": {
        "known": ["fixture account identifier"],
        "unknown": ["all production customer context"]
      },
      "uncertainty": ["real-user behavior is not represented"],
      "decision_policy": { "retry_limit": 2 },
      "communication_policy": { "style": "direct" },
      "state_memory": { "scope": "scenario" },
      "friction_behaviors": [],
      "abstention": { "when_unsupported": true },
      "slices": ["standard"]
    },
    {
      "id": "risk-actor",
      "weight": 0.3,
      "actor_class": "edge",
      "persona_ids": ["P-999"],
      "goals": ["complete the deterministic support task"],
      "invariants": ["do not infer real-user behavior"],
      "knowledge": {
        "known": ["fixture account identifier"],
        "unknown": ["all production customer context"]
      },
      "uncertainty": ["real-user behavior is not represented"],
      "decision_policy": { "retry_limit": 1 },
      "communication_policy": { "style": "ambiguous" },
      "state_memory": { "scope": "scenario" },
      "friction_behaviors": ["provide ambiguous input once"],
      "abstention": { "when_unsupported": true },
      "slices": ["risk"]
    }
  ],
  "generator": {
    "kind": "deterministic-manifest",
    "name": "cascade-persona-derivation",
    "version": "1.0.0",
    "input_digest": "85c75450ebc173de8e1349f48c84fb64bca41a0554f66fdce163c2f700e49473"
  },
  "evidence_sources": [
    {
      "id": "framework-fixture-source",
      "kind": "framework-fixture",
      "reference": "P-999 exists only to exercise contract mechanics.",
      "minimized": true
    }
  ],
  "review": {
    "status": "approved",
    "reviewer_identity": "cascade-harness-maintainer",
    "reviewed_at": "2026-08-03T00:00:00Z"
  }
}
